metric,plain_language_meaning,better_direction,good_pattern_here,tradeoff_captured
Balanced accuracy,"How well the model separates the classes overall, without letting the biggest class dominate the score.",Higher is better,Higher than the benchmark while still holding up in blocked validation.,Discrimination between classes.
Log loss,"How much probability the model places on the right answer, with a strong penalty for confident wrong answers.",Lower is better,"Low values for both repeated and blocked validation, especially for the leading candidates.",Probability quality and overconfidence penalties.
Macro Brier score,How close the predicted probabilities are to what actually happened across the classes.,Lower is better,Low values alongside sensible calibration and not just sharper but brittle probabilities.,Overall probability accuracy.
Confidence ECE,"How believable the model's stated confidence is. If it says 80% confidence often, about 80% of those cases should be right.",Lower is better,Low enough that the model's confidence looks believable rather than exaggerated.,Calibration of stated confidence.
Indeterminate rate,How often the model declines to make a confident call after uncertainty is taken into account.,Not automatically lower,"Moderate rather than extreme: enough indeterminate cases to avoid false certainty, but not so many that the model becomes unusable.",Operational coverage versus caution.
Class-switch rate,How often technical uncertainty changes the predicted class across Monte Carlo draws.,Lower is generally better,Low enough that assay noise usually softens borderline calls instead of flipping birds into different classes.,Stability under measurement uncertainty.
